<?xml version="1.0" encoding="UTF-8" standalone="yes"?>
<otp:Project xmlns="http://www.w3.org/2001/XMLSchema" xmlns:otp="http://www.OpenTravel.org/ns/OTA2/Project_v01_00"
    xmlns:xsi="http://www.w3.org/2001/XMLSchema-instance"
    xsi:schemaLocation="http://www.OpenTravel.org/ns/OTA2/Project_v01_00 ../../../../../../schema-compiler/src/main/resources/ota2-context/schemas/OTA2_Project_v1.0.0.xsd">
    <otp:projectId>http://www.OpenTravel.org/projects/test/versions/2</otp:projectId>
    <otp:name>Version Test Project</otp:name>
    <otp:description>Test description for the project.</otp:description>
    <otp:ManagedProjectItem defaultItem="true">
    	<otp:Repository>test-repository</otp:Repository>
        <otp:BaseNamespace>http://www.OpenTravel.org/ns/OTA2/SchemaCompiler/version-test</otp:BaseNamespace>
        <otp:Filename>Version_Test_1_1_0.otm</otp:Filename>
        <otp:Version>1.1.0</otp:Version>
    </otp:ManagedProjectItem>
    <otp:RepositoryReferences>
        <otp:RepositoryRef repositoryId="test-repository">http://localhost:9293/ota2-repository-service</otp:RepositoryRef>
    </otp:RepositoryReferences>
</otp:Project>
